{
  "admissible_for_release": true,
  "artifact": "certificate.json",
  "certificate_id": "cert-trace-1b7eec6a-265c-4e03-ac97-9a5ec661d50b",
  "certificate_type": "TraceCertificate.v0",
  "formal_predicate": "CertificateMatchesRuntime",
  "schema_version": "v0",
  "signature_or_digest": "sha256:5e3b114643dcd71e87acb8f039cc468c5ee1f69013d763f275bf5779cf8bc843",
  "source_commit": "cb6848001e2e60a484e04eba5ad6be3fe2e4eccc",
  "source_repo": "https://github.com/fraware/CertifyEdge",
  "status": "CertificateChecked",
  "trace_hash": "sha256:c3e8a3dc4ad86d533de1dfa4ae7fe2a338c2cff3c945404c96a75216524d58cd"
}
